{
  "generated_at": "2025-11-06T15:23:16.576998+00:00",
  "schema_version": "1.0.0",
  "documents": [
    {
      "source_path": "rules_updates/agt/ Diario da Republica - SeÃÅrie - N.¬∫ 52.pdf",
      "filename": " Diario da Republica - SeÃÅrie - N.¬∫ 52.pdf",
      "filesize": 3415138,
      "hash_sha256": "bf8d78be9f8a0dadf7e90b6e169584db1b8a79de0ebf5cb95dee7d6df381ae41",
      "title": " Diario da Republica - SeÃÅrie - N.¬∫ 52",
      "doc_date": null,
      "date_confidence": "low",
      "version": null,
      "type": null,
      "entities": [],
      "abstract": "",
      "uncertainty_level": "high"
    },
    {
      "source_path": "rules_updates/agt/799d189a-c2e9-4732-84d9-5bd00d5afc34.pdf",
      "filename": "799d189a-c2e9-4732-84d9-5bd00d5afc34.pdf",
      "filesize": 1797183,
      "hash_sha256": "1c430752e43c4ec43328fda6c6eead7dfe051ffbdb05162ff0349b7110b274ec",
      "title": "DIREC√á√ÉO DE COBRAN√áA, REEMBOLSO E RESTITUI√á√ïES",
      "doc_date": null,
      "date_confidence": "low",
      "version": null,
      "type": null,
      "entities": [
        "AGT",
        "CIVA",
        "IVA",
        "SAF-T (AO)",
        "Software"
      ],
      "abstract": "DIREC√á√ÉO DE COBRAN√áA, REEMBOLSO E RESTITUI√á√ïES\n\nDEPARTAMENTO DE FACTURA√á√ÉO ELECTR√ìNICA",
      "uncertainty_level": "high"
    },
    {
      "source_path": "rules_updates/agt/Circular_20_1756751309.pdf",
      "filename": "Circular_20_1756751309.pdf",
      "filesize": 921382,
      "hash_sha256": "09811ac9317c847af65d84eb01f6c23211891e7e56d2e6c1c16e3a377c3920c9",
      "title": "Circular 20 1756751309",
      "doc_date": null,
      "date_confidence": "low",
      "version": null,
      "type": "circular",
      "entities": [],
      "abstract": "",
      "uncertainty_level": "high"
    },
    {
      "source_path": "rules_updates/agt/Circular_AGT_MudancÃßa de Softwares_20_1756751309[1] Copy.pdf",
      "filename": "Circular_AGT_MudancÃßa de Softwares_20_1756751309[1] Copy.pdf",
      "filesize": 921265,
      "hash_sha256": "abb78c985f10de802e059ed9750e0960a807a1a6513adb0b5a829774b160bf13",
      "title": "Circular AGT MudancÃßa de Softwares 20 1756751309[1] Copy",
      "doc_date": null,
      "date_confidence": "low",
      "version": null,
      "type": "circular",
      "entities": [],
      "abstract": "",
      "uncertainty_level": "high"
    },
    {
      "source_path": "rules_updates/agt/Comunicado - MINSA-OÃÅRGAÃÉO CENTRAL_CP2022_ENAPP-ERU.pdf",
      "filename": "Comunicado - MINSA-OÃÅRGAÃÉO CENTRAL_CP2022_ENAPP-ERU.pdf",
      "filesize": 60266,
      "hash_sha256": "4535b6995f8f7836138a784ff971e9b156de704e6d94666f490cfeb407a4ac75",
      "title": "Comunicado - MINSA-OÃÅRGAÃÉO CENTRAL CP2022 ENAPP-ERU",
      "doc_date": null,
      "date_confidence": "low",
      "version": null,
      "type": null,
      "entities": [],
      "abstract": "",
      "uncertainty_level": "high"
    },
    {
      "source_path": "rules_updates/agt/DECRETO EXECUTIVO 683_25 DEFINE A ESTRUTURA DE DAD_250828_092409.pdf",
      "filename": "DECRETO EXECUTIVO 683_25 DEFINE A ESTRUTURA DE DAD_250828_092409.pdf",
      "filesize": 6940951,
      "hash_sha256": "b01e45813eccc54790ce23ae64bba4564731566476bb3dec0105c15ad4f223ca",
      "title": "DECRETO EXECUTIVO 683 25 DEFINE A ESTRUTURA DE DAD 250828 092409",
      "doc_date": null,
      "date_confidence": "low",
      "version": null,
      "type": "decreto",
      "entities": [],
      "abstract": "",
      "uncertainty_level": "high"
    },
    {
      "source_path": "rules_updates/agt/Decreto Presidencial n.¬∫ 71-25.pdf",
      "filename": "Decreto Presidencial n.¬∫ 71-25.pdf",
      "filesize": 3415280,
      "hash_sha256": "20c12a224460f1b9d10357b523abc8e1ac9ce49ce22c681b35d6906402ec077b",
      "title": "Decreto Presidencial n.¬∫ 71-25",
      "doc_date": null,
      "date_confidence": "low",
      "version": null,
      "type": "decreto",
      "entities": [],
      "abstract": "",
      "uncertainty_level": "high"
    },
    {
      "source_path": "rules_updates/agt/diploma que define a estrutura de dados de software (1).pdf",
      "filename": "diploma que define a estrutura de dados de software (1).pdf",
      "filesize": 6939474,
      "hash_sha256": "5f991e05eceeceb46b40fbdca96605c0bbe9ed01050cd11d3698a9e5d5067190",
      "title": "diploma que define a estrutura de dados de software (1)",
      "doc_date": null,
      "date_confidence": "low",
      "version": null,
      "type": null,
      "entities": [],
      "abstract": "",
      "uncertainty_level": "high"
    },
    {
      "source_path": "rules_updates/agt/DS-120 EspecificacÃßaÃÉo TeÃÅcnica Consulta de Contribuinte - Consultar (Produtores de Software) v5.0.1.pdf",
      "filename": "DS-120 EspecificacÃßaÃÉo TeÃÅcnica Consulta de Contribuinte - Consultar (Produtores de Software) v5.0.1.pdf",
      "filesize": 455690,
      "hash_sha256": "b4bfe746f8470a6b910e2b56671b4506b2a2c73a7b29a27bbbc3d0b3d88ba931",
      "title": "DS.120 DESIGN SERVICES CONSTRUCTION",
      "doc_date": "2025-08-14",
      "date_confidence": "medium",
      "version": null,
      "type": null,
      "entities": [
        "AGT",
        "IVA",
        "Software"
      ],
      "abstract": "DS.120 DESIGN SERVICES CONSTRUCTION\n\nOUM",
      "uncertainty_level": null
    },
    {
      "source_path": "rules_updates/agt/DS-120.Especificacao.Tecnica.FE.v1.0.pdf",
      "filename": "DS-120.Especificacao.Tecnica.FE.v1.0.pdf",
      "filesize": 1546369,
      "hash_sha256": "94401cfba57ad405ef41c904af4f3b97ff2416724e6b990c78ec5f28197e7009",
      "title": "OUM",
      "doc_date": "2025-10-01",
      "date_confidence": "medium",
      "version": null,
      "type": null,
      "entities": [
        "AGT",
        "CIVA",
        "IVA",
        "SAF-T (AO)",
        "Software"
      ],
      "abstract": "OUM \nDS.120 DESIGN SERVICES CONSTRUCTION\n\nEspecifica√ß√£o T√©cnica de Servi√ßo \nFE ‚Äì Factura√ß√£o Eletr√≥nica",
      "uncertainty_level": null
    },
    {
      "source_path": "rules_updates/agt/ESTRUTURA DE DADOS DE SOFTWARE MODELO DE FACTURACÃßAÃÉO ELECTROÃÅNICA ESPECIFICACÃßOÃÉES TEÃÅCNICAS E PROCEDIMENTA.pdf",
      "filename": "ESTRUTURA DE DADOS DE SOFTWARE MODELO DE FACTURACÃßAÃÉO ELECTROÃÅNICA ESPECIFICACÃßOÃÉES TEÃÅCNICAS E PROCEDIMENTA.pdf",
      "filesize": 1797183,
      "hash_sha256": "1c430752e43c4ec43328fda6c6eead7dfe051ffbdb05162ff0349b7110b274ec",
      "title": "DIREC√á√ÉO DE COBRAN√áA, REEMBOLSO E RESTITUI√á√ïES",
      "doc_date": null,
      "date_confidence": "low",
      "version": null,
      "type": null,
      "entities": [
        "AGT",
        "CIVA",
        "IVA",
        "SAF-T (AO)",
        "Software"
      ],
      "abstract": "DIREC√á√ÉO DE COBRAN√áA, REEMBOLSO E RESTITUI√á√ïES\n\nDEPARTAMENTO DE FACTURA√á√ÉO ELECTR√ìNICA",
      "uncertainty_level": "high"
    },
    {
      "source_path": "rules_updates/agt/ESTRUTURA_DE_DADOS_DE_SOFTWARE_MODELO_DE_FACTURACÃßAÃÉO_ELECTROÃÅNICA.pdf",
      "filename": "ESTRUTURA_DE_DADOS_DE_SOFTWARE_MODELO_DE_FACTURACÃßAÃÉO_ELECTROÃÅNICA.pdf",
      "filesize": 1637621,
      "hash_sha256": "115cf9fb56437b90b4082eee173d7b6190c1e9adb64e9c982706e15ebb5dd61f",
      "title": "DIREC√á√ÉO DE COBRAN√áA, REMBOLSO E RESTITUI√á√ïES",
      "doc_date": null,
      "date_confidence": "low",
      "version": null,
      "type": null,
      "entities": [
        "AGT",
        "CIVA",
        "IVA",
        "SAF-T (AO)",
        "Software"
      ],
      "abstract": "DIREC√á√ÉO DE COBRAN√áA, REMBOLSO E RESTITUI√á√ïES\n\nDEPERTAMENTO DE FATURA√á√ÉO ELECTR√ìNICA",
      "uncertainty_level": "high"
    },
    {
      "source_path": "rules_updates/agt/minfin055809.pdf",
      "filename": "minfin055809.pdf",
      "filesize": 1039021,
      "hash_sha256": "4bc3a781b72964dc52a604ad26edf8b857084172ccd892a727880cb41bd91f73",
      "title": "REGRAS E REQUISITOS PARA VALIDA√á√ÉO DE SISTEMAS",
      "doc_date": null,
      "date_confidence": "low",
      "version": null,
      "type": "decreto",
      "entities": [
        "AGT",
        "IVA",
        "SAF-T (AO)",
        "Software"
      ],
      "abstract": "REGRAS E REQUISITOS PARA VALIDA√á√ÉO DE SISTEMAS\n\nDE PROCESSAMENTO ELECTR√ìNICO DE FACTURA√á√ÉO DOS",
      "uncertainty_level": "high"
    },
    {
      "source_path": "rules_updates/agt/Projecto_Decreto_Executivo_regras_e_requisitos_para_validacÃßaÃÉo.docx",
      "filename": "Projecto_Decreto_Executivo_regras_e_requisitos_para_validacÃßaÃÉo.docx",
      "filesize": 744576,
      "hash_sha256": "e85436685d59e742301dda58b068f19a227cfb9b331fe8d6afb8864338c2357a",
      "title": "PROJECTO DE DECRETO EXECUTIVO",
      "doc_date": null,
      "date_confidence": "low",
      "version": null,
      "type": "decreto",
      "entities": [
        "AGT",
        "IVA",
        "SAF-T (AO)",
        "Software"
      ],
      "abstract": "PROJECTO DE DECRETO EXECUTIVO \nQUE DEFINE A ESTRUTURA DE DADOS DE SOFTWARE, MODELO DE FACTURA√á√ÉO ELECTR√ìNICA, ESPECIFICA√á√ïES T√âCNICAS E PROCEDIMENTAIS\nRELAT√ìRIO DE FUNDAMENTA√á√ÉO\nENQUADRAMENTO\nA implementa√ß√£o da Factura√ß√£o Electr√≥nica, por for√ßa do Decreto Presidencial n.¬∫__/25, de__de_________, √© um marco bastante importante das iniciativas do Executivo no √¢mbito da melhoria cont√≠nua do Sistema Tribut√°rio Angolano.\nTra√ßado o regime geral da Factura√ß√£o Electr√≥nica pelo diploma supra referenciado, urge, pois, criarem-se as condi√ß√µes t√©cnicas relativas √† estrutura de dados de software, a defini√ß√£",
      "uncertainty_level": "high"
    },
    {
      "source_path": "rules_updates/agt/readme.txt",
      "filename": "readme.txt",
      "filesize": 1894,
      "hash_sha256": "938fc0fff2d47e160804e9fb15d045a30d36ad4acedb3c997b2ba27400489efc",
      "title": "# üìò AGT ‚Äî Regras, Comunicados e Atualiza√ß√µes Oficiais",
      "doc_date": "2024-12-15",
      "date_confidence": "medium",
      "version": null,
      "type": "circular",